{
  "schemaVersion": 1,
  "kind": "ArtifactMirrored",
  "recordedAt": "2026-08-25T06:21:36Z",
  "source": {
    "type": "github-actions",
    "workflow": "mirror / quarantine/python",
    "runUrl": "https://github.com/toddysm/cssc-framework/actions/runs/32816568923",
    "runId": "32816568923",
    "runAttempt": "1"
  },
  "from": {
    "registry": "docker.io",
    "repository": "library/python",
    "digest": "sha256:8a14a31f4bf634c04722154f30eb33998b4068de8b83b6b2800ec1b7238555d0"
  },
  "to": {
    "registry": "ghcr.io",
    "repository": "toddysm/quarantine/python",
    "digest": "sha256:8a14a31f4bf634c04722154f30eb33998b4068de8b83b6b2800ec1b7238555d0"
  },
  "tag": "3.14-slim",
  "id": "sha256:a2c71a5ec9c220f7a9a948e980c8319c73ad036031982add117897a0736c39dc"
}
