{
  "schemaVersion": 1,
  "kind": "ArtifactMirrored",
  "recordedAt": "2026-08-28T17:44:50Z",
  "source": {
    "type": "github-actions",
    "workflow": "mirror / quarantine/python",
    "runUrl": "https://github.com/toddysm/cssc-framework/actions/runs/33196052999",
    "runId": "33196052999",
    "runAttempt": "1"
  },
  "from": {
    "registry": "docker.io",
    "repository": "library/python",
    "digest": "sha256:cae66f2ef0ec51a9891263eeee7f987dacf0a9879e8aa9353d5606e0530619a5"
  },
  "to": {
    "registry": "ghcr.io",
    "repository": "toddysm/quarantine/python",
    "digest": "sha256:cae66f2ef0ec51a9891263eeee7f987dacf0a9879e8aa9353d5606e0530619a5"
  },
  "tag": "3.14-slim",
  "id": "sha256:9adf34da33f8f7be770c3534cf303e0679d3fe203c22596fb7ca8dda8d68e667"
}
